    1 0.000000000 172.16.155.129 → 208.80.153.224 TCP 74 34898 → 443 [SYN] Seq=0 Win=64240 Len=0 MSS=1460 SACK_PERM TSval=519117194 TSecr=0 WS=128
Frame 1: 74 bytes on wire (592 bits), 74 bytes captured (592 bits) on interface eth0, id 0
    Section number: 1
    Interface id: 0 (eth0)
        Interface name: eth0
    Encapsulation type: Ethernet (1)
    Arrival Time: Feb 27, 2023 18:46:40.713325167 UTC
    [Time shift for this packet: 0.000000000 seconds]
    Epoch Time: 1677523600.713325167 seconds
    [Time delta from previous captured frame: 0.000000000 seconds]
    [Time delta from previous displayed frame: 0.000000000 seconds]
    [Time since reference or first frame: 0.000000000 seconds]
    Frame Number: 1
    Frame Length: 74 bytes (592 bits)
    Capture Length: 74 bytes (592 bits)
    [Frame is marked: False]
    [Frame is ignored: False]
    [Protocols in frame: eth:ethertype:ip:tcp]
Ethernet II, Src: VMware_3d:df:29 (00:0c:29:3d:df:29), Dst: VMware_e4:5c:4a (00:50:56:e4:5c:4a)
    Destination: VMware_e4:5c:4a (00:50:56:e4:5c:4a)
        Address: VMware_e4:5c:4a (00:50:56:e4:5c:4a)
        .... ..0. .... .... .... .... = LG bit: Globally unique address (factory default)
        .... ...0 .... .... .... .... = IG bit: Individual address (unicast)
    Source: VMware_3d:df:29 (00:0c:29:3d:df:29)
        Address: VMware_3d:df:29 (00:0c:29:3d:df:29)
        .... ..0. .... .... .... .... = LG bit: Globally unique address (factory default)
        .... ...0 .... .... .... .... = IG bit: Individual address (unicast)
    Type: IPv4 (0x0800)
Internet Protocol Version 4, Src: 172.16.155.129, Dst: 208.80.153.224
    0100 .... = Version: 4
    .... 0101 = Header Length: 20 bytes (5)
    Differentiated Services Field: 0x00 (DSCP: CS0, ECN: Not-ECT)
        0000 00.. = Differentiated Services Codepoint: Default (0)
        .... ..00 = Explicit Congestion Notification: Not ECN-Capable Transport (0)
    Total Length: 60
    Identification: 0x559b (21915)
    010. .... = Flags: 0x2, Don't fragment
        0... .... = Reserved bit: Not set
        .1.. .... = Don't fragment: Set
        ..0. .... = More fragments: Not set
    ...0 0000 0000 0000 = Fragment Offset: 0
    Time to Live: 64
    Protocol: TCP (6)
    Header Checksum: 0x335e [validation disabled]
    [Header checksum status: Unverified]
    Source Address: 172.16.155.129
    Destination Address: 208.80.153.224
Transmission Control Protocol, Src Port: 34898, Dst Port: 443, Seq: 0, Len: 0
    Source Port: 34898
    Destination Port: 443
    [Stream index: 0]
    [Conversation completeness: Incomplete (0)]
    [TCP Segment Len: 0]
    Sequence Number: 0    (relative sequence number)
    Sequence Number (raw): 414532106
    [Next Sequence Number: 1    (relative sequence number)]
    Acknowledgment Number: 0
    Acknowledgment number (raw): 0
    1010 .... = Header Length: 40 bytes (10)
    Flags: 0x002 (SYN)
        000. .... .... = Reserved: Not set
        ...0 .... .... = Accurate ECN: Not set
        .... 0... .... = Congestion Window Reduced: Not set
        .... .0.. .... = ECN-Echo: Not set
        .... ..0. .... = Urgent: Not set
        .... ...0 .... = Acknowledgment: Not set
        .... .... 0... = Push: Not set
        .... .... .0.. = Reset: Not set
        .... .... ..1. = Syn: Set
            [Expert Info (Chat/Sequence): Connection establish request (SYN): server port 443]
                [Connection establish request (SYN): server port 443]
                [Severity level: Chat]
                [Group: Sequence]
        .... .... ...0 = Fin: Not set
        [TCP Flags: ··········S·]
    Window: 64240
    [Calculated window size: 64240]
    Checksum: 0xb1f1 [unverified]
    [Checksum Status: Unverified]
    Urgent Pointer: 0
    Options: (20 bytes), Maximum segment size, SACK permitted, Timestamps, No-Operation (NOP), Window scale
        TCP Option - Maximum segment size: 1460 bytes
            Kind: Maximum Segment Size (2)
            Length: 4
            MSS Value: 1460
        TCP Option - SACK permitted
            Kind: SACK Permitted (4)
            Length: 2
        TCP Option - Timestamps
            Kind: Time Stamp Option (8)
            Length: 10
            Timestamp value: 519117194: TSval 519117194, TSecr 0
            Timestamp echo reply: 0
        TCP Option - No-Operation (NOP)
            Kind: No-Operation (1)
        TCP Option - Window scale: 7 (multiply by 128)
            Kind: Window Scale (3)
            Length: 3
            Shift count: 7
            [Multiplier: 128]
    [Timestamps]
        [Time since first frame in this TCP stream: 0.000000000 seconds]
        [Time since previous frame in this TCP stream: 0.000000000 seconds]

    2 0.038516390 208.80.153.224 → 172.16.155.129 TCP 60 443 → 34898 [SYN, ACK] Seq=0 Ack=1 Win=64240 Len=0 MSS=1460
Frame 2: 60 bytes on wire (480 bits), 60 bytes captured (480 bits) on interface eth0, id 0
    Section number: 1
    Interface id: 0 (eth0)
        Interface name: eth0
    Encapsulation type: Ethernet (1)
    Arrival Time: Feb 27, 2023 18:46:40.751841557 UTC
    [Time shift for this packet: 0.000000000 seconds]
    Epoch Time: 1677523600.751841557 seconds
    [Time delta from previous captured frame: 0.038516390 seconds]
    [Time delta from previous displayed frame: 0.038516390 seconds]
    [Time since reference or first frame: 0.038516390 seconds]
    Frame Number: 2
    Frame Length: 60 bytes (480 bits)
    Capture Length: 60 bytes (480 bits)
    [Frame is marked: False]
    [Frame is ignored: False]
    [Protocols in frame: eth:ethertype:ip:tcp]
Ethernet II, Src: VMware_e4:5c:4a (00:50:56:e4:5c:4a), Dst: VMware_3d:df:29 (00:0c:29:3d:df:29)
    Destination: VMware_3d:df:29 (00:0c:29:3d:df:29)
        Address: VMware_3d:df:29 (00:0c:29:3d:df:29)
        .... ..0. .... .... .... .... = LG bit: Globally unique address (factory default)
        .... ...0 .... .... .... .... = IG bit: Individual address (unicast)
    Source: VMware_e4:5c:4a (00:50:56:e4:5c:4a)
        Address: VMware_e4:5c:4a (00:50:56:e4:5c:4a)
        .... ..0. .... .... .... .... = LG bit: Globally unique address (factory default)
        .... ...0 .... .... .... .... = IG bit: Individual address (unicast)
    Type: IPv4 (0x0800)
    Padding: 0000
Internet Protocol Version 4, Src: 208.80.153.224, Dst: 172.16.155.129
    0100 .... = Version: 4
    .... 0101 = Header Length: 20 bytes (5)
    Differentiated Services Field: 0x00 (DSCP: CS0, ECN: Not-ECT)
        0000 00.. = Differentiated Services Codepoint: Default (0)
        .... ..00 = Explicit Congestion Notification: Not ECN-Capable Transport (0)
    Total Length: 44
    Identification: 0x0a6f (2671)
    000. .... = Flags: 0x0
        0... .... = Reserved bit: Not set
        .0.. .... = Don't fragment: Not set
        ..0. .... = More fragments: Not set
    ...0 0000 0000 0000 = Fragment Offset: 0
    Time to Live: 128
    Protocol: TCP (6)
    Header Checksum: 0x7e9a [validation disabled]
    [Header checksum status: Unverified]
    Source Address: 208.80.153.224
    Destination Address: 172.16.155.129
Transmission Control Protocol, Src Port: 443, Dst Port: 34898, Seq: 0, Ack: 1, Len: 0
    Source Port: 443
    Destination Port: 34898
    [Stream index: 0]
    [Conversation completeness: Incomplete, SYN_SENT (1)]
    [TCP Segment Len: 0]
    Sequence Number: 0    (relative sequence number)
    Sequence Number (raw): 4010768873
    [Next Sequence Number: 1    (relative sequence number)]
    Acknowledgment Number: 1    (relative ack number)
    Acknowledgment number (raw): 414532107
    0110 .... = Header Length: 24 bytes (6)
    Flags: 0x012 (SYN, ACK)
        000. .... .... = Reserved: Not set
        ...0 .... .... = Accurate ECN: Not set
        .... 0... .... = Congestion Window Reduced: Not set
        .... .0.. .... = ECN-Echo: Not set
        .... ..0. .... = Urgent: Not set
        .... ...1 .... = Acknowledgment: Set
        .... .... 0... = Push: Not set
        .... .... .0.. = Reset: Not set
        .... .... ..1. = Syn: Set
            [Expert Info (Chat/Sequence): Connection establish acknowledge (SYN+ACK): server port 443]
                [Connection establish acknowledge (SYN+ACK): server port 443]
                [Severity level: Chat]
                [Group: Sequence]
        .... .... ...0 = Fin: Not set
        [TCP Flags: ·······A··S·]
    Window: 64240
    [Calculated window size: 64240]
    Checksum: 0x9d9b [unverified]
    [Checksum Status: Unverified]
    Urgent Pointer: 0
    Options: (4 bytes), Maximum segment size
        TCP Option - Maximum segment size: 1460 bytes
            Kind: Maximum Segment Size (2)
            Length: 4
            MSS Value: 1460
    [Timestamps]
        [Time since first frame in this TCP stream: 0.038516390 seconds]
        [Time since previous frame in this TCP stream: 0.038516390 seconds]
    [SEQ/ACK analysis]
        [This is an ACK to the segment in frame: 1]
        [The RTT to ACK the segment was: 0.038516390 seconds]

    3 0.038571429 172.16.155.129 → 208.80.153.224 TCP 54 34898 → 443 [ACK] Seq=1 Ack=1 Win=64240 Len=0
Frame 3: 54 bytes on wire (432 bits), 54 bytes captured (432 bits) on interface eth0, id 0
    Section number: 1
    Interface id: 0 (eth0)
        Interface name: eth0
    Encapsulation type: Ethernet (1)
    Arrival Time: Feb 27, 2023 18:46:40.751896596 UTC
    [Time shift for this packet: 0.000000000 seconds]
    Epoch Time: 1677523600.751896596 seconds
    [Time delta from previous captured frame: 0.000055039 seconds]
    [Time delta from previous displayed frame: 0.000055039 seconds]
    [Time since reference or first frame: 0.038571429 seconds]
    Frame Number: 3
    Frame Length: 54 bytes (432 bits)
    Capture Length: 54 bytes (432 bits)
    [Frame is marked: False]
    [Frame is ignored: False]
    [Protocols in frame: eth:ethertype:ip:tcp]
Ethernet II, Src: VMware_3d:df:29 (00:0c:29:3d:df:29), Dst: VMware_e4:5c:4a (00:50:56:e4:5c:4a)
    Destination: VMware_e4:5c:4a (00:50:56:e4:5c:4a)
        Address: VMware_e4:5c:4a (00:50:56:e4:5c:4a)
        .... ..0. .... .... .... .... = LG bit: Globally unique address (factory default)
        .... ...0 .... .... .... .... = IG bit: Individual address (unicast)
    Source: VMware_3d:df:29 (00:0c:29:3d:df:29)
        Address: VMware_3d:df:29 (00:0c:29:3d:df:29)
        .... ..0. .... .... .... .... = LG bit: Globally unique address (factory default)
        .... ...0 .... .... .... .... = IG bit: Individual address (unicast)
    Type: IPv4 (0x0800)
Internet Protocol Version 4, Src: 172.16.155.129, Dst: 208.80.153.224
    0100 .... = Version: 4
    .... 0101 = Header Length: 20 bytes (5)
    Differentiated Services Field: 0x00 (DSCP: CS0, ECN: Not-ECT)
        0000 00.. = Differentiated Services Codepoint: Default (0)
        .... ..00 = Explicit Congestion Notification: Not ECN-Capable Transport (0)
    Total Length: 40
    Identification: 0x559c (21916)
    010. .... = Flags: 0x2, Don't fragment
        0... .... = Reserved bit: Not set
        .1.. .... = Don't fragment: Set
        ..0. .... = More fragments: Not set
    ...0 0000 0000 0000 = Fragment Offset: 0
    Time to Live: 64
    Protocol: TCP (6)
    Header Checksum: 0x3371 [validation disabled]
    [Header checksum status: Unverified]
    Source Address: 172.16.155.129
    Destination Address: 208.80.153.224
Transmission Control Protocol, Src Port: 34898, Dst Port: 443, Seq: 1, Ack: 1, Len: 0
    Source Port: 34898
    Destination Port: 443
    [Stream index: 0]
    [Conversation completeness: Incomplete, CLIENT_ESTABLISHED (3)]
    [TCP Segment Len: 0]
    Sequence Number: 1    (relative sequence number)
    Sequence Number (raw): 414532107
    [Next Sequence Number: 1    (relative sequence number)]
    Acknowledgment Number: 1    (relative ack number)
    Acknowledgment number (raw): 4010768874
    0101 .... = Header Length: 20 bytes (5)
    Flags: 0x010 (ACK)
        000. .... .... = Reserved: Not set
        ...0 .... .... = Accurate ECN: Not set
        .... 0... .... = Congestion Window Reduced: Not set
        .... .0.. .... = ECN-Echo: Not set
        .... ..0. .... = Urgent: Not set
        .... ...1 .... = Acknowledgment: Set
        .... .... 0... = Push: Not set
        .... .... .0.. = Reset: Not set
        .... .... ..0. = Syn: Not set
        .... .... ...0 = Fin: Not set
        [TCP Flags: ·······A····]
    Window: 64240
    [Calculated window size: 64240]
    [Window size scaling factor: -2 (no window scaling used)]
    Checksum: 0xb1dd [unverified]
    [Checksum Status: Unverified]
    Urgent Pointer: 0
    [Timestamps]
        [Time since first frame in this TCP stream: 0.038571429 seconds]
        [Time since previous frame in this TCP stream: 0.000055039 seconds]
    [SEQ/ACK analysis]
        [This is an ACK to the segment in frame: 2]
        [The RTT to ACK the segment was: 0.000055039 seconds]
        [iRTT: 0.038571429 seconds]

    4 0.068935835 172.16.155.129 → 208.80.153.224 TLSv1 571 Client Hello
Frame 4: 571 bytes on wire (4568 bits), 571 bytes captured (4568 bits) on interface eth0, id 0
    Section number: 1
    Interface id: 0 (eth0)
        Interface name: eth0
    Encapsulation type: Ethernet (1)
    Arrival Time: Feb 27, 2023 18:46:40.782261002 UTC
    [Time shift for this packet: 0.000000000 seconds]
    Epoch Time: 1677523600.782261002 seconds
    [Time delta from previous captured frame: 0.030364406 seconds]
    [Time delta from previous displayed frame: 0.030364406 seconds]
    [Time since reference or first frame: 0.068935835 seconds]
    Frame Number: 4
    Frame Length: 571 bytes (4568 bits)
    Capture Length: 571 bytes (4568 bits)
    [Frame is marked: False]
    [Frame is ignored: False]
    [Protocols in frame: eth:ethertype:ip:tcp:tls]
Ethernet II, Src: VMware_3d:df:29 (00:0c:29:3d:df:29), Dst: VMware_e4:5c:4a (00:50:56:e4:5c:4a)
    Destination: VMware_e4:5c:4a (00:50:56:e4:5c:4a)
        Address: VMware_e4:5c:4a (00:50:56:e4:5c:4a)
        .... ..0. .... .... .... .... = LG bit: Globally unique address (factory default)
        .... ...0 .... .... .... .... = IG bit: Individual address (unicast)
    Source: VMware_3d:df:29 (00:0c:29:3d:df:29)
        Address: VMware_3d:df:29 (00:0c:29:3d:df:29)
        .... ..0. .... .... .... .... = LG bit: Globally unique address (factory default)
        .... ...0 .... .... .... .... = IG bit: Individual address (unicast)
    Type: IPv4 (0x0800)
Internet Protocol Version 4, Src: 172.16.155.129, Dst: 208.80.153.224
    0100 .... = Version: 4
    .... 0101 = Header Length: 20 bytes (5)
    Differentiated Services Field: 0x00 (DSCP: CS0, ECN: Not-ECT)
        0000 00.. = Differentiated Services Codepoint: Default (0)
        .... ..00 = Explicit Congestion Notification: Not ECN-Capable Transport (0)
    Total Length: 557
    Identification: 0x559d (21917)
    010. .... = Flags: 0x2, Don't fragment
        0... .... = Reserved bit: Not set
        .1.. .... = Don't fragment: Set
        ..0. .... = More fragments: Not set
    ...0 0000 0000 0000 = Fragment Offset: 0
    Time to Live: 64
    Protocol: TCP (6)
    Header Checksum: 0x316b [validation disabled]
    [Header checksum status: Unverified]
    Source Address: 172.16.155.129
    Destination Address: 208.80.153.224
Transmission Control Protocol, Src Port: 34898, Dst Port: 443, Seq: 1, Ack: 1, Len: 517
    Source Port: 34898
    Destination Port: 443
    [Stream index: 0]
    [Conversation completeness: Incomplete, ESTABLISHED (7)]
    [TCP Segment Len: 517]
    Sequence Number: 1    (relative sequence number)
    Sequence Number (raw): 414532107
    [Next Sequence Number: 518    (relative sequence number)]
    Acknowledgment Number: 1    (relative ack number)
    Acknowledgment number (raw): 4010768874
    0101 .... = Header Length: 20 bytes (5)
    Flags: 0x018 (PSH, ACK)
        000. .... .... = Reserved: Not set
        ...0 .... .... = Accurate ECN: Not set
        .... 0... .... = Congestion Window Reduced: Not set
        .... .0.. .... = ECN-Echo: Not set
        .... ..0. .... = Urgent: Not set
        .... ...1 .... = Acknowledgment: Set
        .... .... 1... = Push: Set
        .... .... .0.. = Reset: Not set
        .... .... ..0. = Syn: Not set
        .... .... ...0 = Fin: Not set
        [TCP Flags: ·······AP···]
    Window: 64240
    [Calculated window size: 64240]
    [Window size scaling factor: -2 (no window scaling used)]
    Checksum: 0xb3e2 [unverified]
    [Checksum Status: Unverified]
    Urgent Pointer: 0
    [Timestamps]
        [Time since first frame in this TCP stream: 0.068935835 seconds]
        [Time since previous frame in this TCP stream: 0.030364406 seconds]
    [SEQ/ACK analysis]
        [iRTT: 0.038571429 seconds]
        [Bytes in flight: 517]
        [Bytes sent since last PSH flag: 517]
    TCP payload (517 bytes)
Transport Layer Security
    TLSv1 Record Layer: Handshake Protocol: Client Hello
        Content Type: Handshake (22)
        Version: TLS 1.0 (0x0301)
        Length: 512
        Handshake Protocol: Client Hello
            Handshake Type: Client Hello (1)
            Length: 508
            Version: TLS 1.2 (0x0303)
            Random: f986276bd67d884893d8c5d644e08d1982ce739167813cad21eb3d2604c2814a
                GMT Unix Time: Aug 29, 2102 18:18:19.000000000 UTC
                Random Bytes: d67d884893d8c5d644e08d1982ce739167813cad21eb3d2604c2814a
            Session ID Length: 32
            Session ID: 34162808eb17dbc178db5fb984bed9e9de03fca8a0037d6a14bd18d8f3ee994f
            Cipher Suites Length: 182
            Cipher Suites (91 suites)
                Cipher Suite: TLS_AES_256_GCM_SHA384 (0x1302)
                Cipher Suite: TLS_CHACHA20_POLY1305_SHA256 (0x1303)
                Cipher Suite: TLS_AES_128_GCM_SHA256 (0x1301)
                Cipher Suite: TLS_ECDHE_ECDSA_WITH_AES_256_GCM_SHA384 (0xc02c)
                Cipher Suite: TLS_ECDHE_RSA_WITH_AES_256_GCM_SHA384 (0xc030)
                Cipher Suite: TLS_DHE_DSS_WITH_AES_256_GCM_SHA384 (0x00a3)
                Cipher Suite: TLS_DHE_RSA_WITH_AES_256_GCM_SHA384 (0x009f)
                Cipher Suite: TLS_ECDHE_ECDSA_WITH_CHACHA20_POLY1305_SHA256 (0xcca9)
                Cipher Suite: TLS_ECDHE_RSA_WITH_CHACHA20_POLY1305_SHA256 (0xcca8)
                Cipher Suite: TLS_DHE_RSA_WITH_CHACHA20_POLY1305_SHA256 (0xccaa)
                Cipher Suite: TLS_ECDHE_ECDSA_WITH_AES_256_CCM_8 (0xc0af)
                Cipher Suite: TLS_ECDHE_ECDSA_WITH_AES_256_CCM (0xc0ad)
                Cipher Suite: TLS_DHE_RSA_WITH_AES_256_CCM_8 (0xc0a3)
                Cipher Suite: TLS_DHE_RSA_WITH_AES_256_CCM (0xc09f)
                Cipher Suite: TLS_ECDHE_ECDSA_WITH_ARIA_256_GCM_SHA384 (0xc05d)
                Cipher Suite: TLS_ECDHE_RSA_WITH_ARIA_256_GCM_SHA384 (0xc061)
                Cipher Suite: TLS_DHE_DSS_WITH_ARIA_256_GCM_SHA384 (0xc057)
                Cipher Suite: TLS_DHE_RSA_WITH_ARIA_256_GCM_SHA384 (0xc053)
                Cipher Suite: TLS_DH_anon_WITH_AES_256_GCM_SHA384 (0x00a7)
                Cipher Suite: TLS_ECDHE_ECDSA_WITH_AES_128_GCM_SHA256 (0xc02b)
                Cipher Suite: TLS_ECDHE_RSA_WITH_AES_128_GCM_SHA256 (0xc02f)
                Cipher Suite: TLS_DHE_DSS_WITH_AES_128_GCM_SHA256 (0x00a2)
                Cipher Suite: TLS_DHE_RSA_WITH_AES_128_GCM_SHA256 (0x009e)
                Cipher Suite: TLS_ECDHE_ECDSA_WITH_AES_128_CCM_8 (0xc0ae)
                Cipher Suite: TLS_ECDHE_ECDSA_WITH_AES_128_CCM (0xc0ac)
                Cipher Suite: TLS_DHE_RSA_WITH_AES_128_CCM_8 (0xc0a2)
                Cipher Suite: TLS_DHE_RSA_WITH_AES_128_CCM (0xc09e)
                Cipher Suite: TLS_ECDHE_ECDSA_WITH_ARIA_128_GCM_SHA256 (0xc05c)
                Cipher Suite: TLS_ECDHE_RSA_WITH_ARIA_128_GCM_SHA256 (0xc060)
                Cipher Suite: TLS_DHE_DSS_WITH_ARIA_128_GCM_SHA256 (0xc056)
                Cipher Suite: TLS_DHE_RSA_WITH_ARIA_128_GCM_SHA256 (0xc052)
                Cipher Suite: TLS_DH_anon_WITH_AES_128_GCM_SHA256 (0x00a6)
                Cipher Suite: TLS_ECDHE_ECDSA_WITH_AES_256_CBC_SHA384 (0xc024)
                Cipher Suite: TLS_ECDHE_RSA_WITH_AES_256_CBC_SHA384 (0xc028)
                Cipher Suite: TLS_DHE_RSA_WITH_AES_256_CBC_SHA256 (0x006b)
                Cipher Suite: TLS_DHE_DSS_WITH_AES_256_CBC_SHA256 (0x006a)
                Cipher Suite: TLS_ECDHE_ECDSA_WITH_CAMELLIA_256_CBC_SHA384 (0xc073)
                Cipher Suite: TLS_ECDHE_RSA_WITH_CAMELLIA_256_CBC_SHA384 (0xc077)
                Cipher Suite: TLS_DHE_RSA_WITH_CAMELLIA_256_CBC_SHA256 (0x00c4)
                Cipher Suite: TLS_DHE_DSS_WITH_CAMELLIA_256_CBC_SHA256 (0x00c3)
                Cipher Suite: TLS_DH_anon_WITH_AES_256_CBC_SHA256 (0x006d)
                Cipher Suite: TLS_DH_anon_WITH_CAMELLIA_256_CBC_SHA256 (0x00c5)
                Cipher Suite: TLS_ECDHE_ECDSA_WITH_AES_128_CBC_SHA256 (0xc023)
                Cipher Suite: TLS_ECDHE_RSA_WITH_AES_128_CBC_SHA256 (0xc027)
                Cipher Suite: TLS_DHE_RSA_WITH_AES_128_CBC_SHA256 (0x0067)
                Cipher Suite: TLS_DHE_DSS_WITH_AES_128_CBC_SHA256 (0x0040)
                Cipher Suite: TLS_ECDHE_ECDSA_WITH_CAMELLIA_128_CBC_SHA256 (0xc072)
                Cipher Suite: TLS_ECDHE_RSA_WITH_CAMELLIA_128_CBC_SHA256 (0xc076)
                Cipher Suite: TLS_DHE_RSA_WITH_CAMELLIA_128_CBC_SHA256 (0x00be)
                Cipher Suite: TLS_DHE_DSS_WITH_CAMELLIA_128_CBC_SHA256 (0x00bd)
                Cipher Suite: TLS_DH_anon_WITH_AES_128_CBC_SHA256 (0x006c)
                Cipher Suite: TLS_DH_anon_WITH_CAMELLIA_128_CBC_SHA256 (0x00bf)
                Cipher Suite: TLS_ECDHE_ECDSA_WITH_AES_256_CBC_SHA (0xc00a)
                Cipher Suite: TLS_ECDHE_RSA_WITH_AES_256_CBC_SHA (0xc014)
                Cipher Suite: TLS_DHE_RSA_WITH_AES_256_CBC_SHA (0x0039)
                Cipher Suite: TLS_DHE_DSS_WITH_AES_256_CBC_SHA (0x0038)
                Cipher Suite: TLS_DHE_RSA_WITH_CAMELLIA_256_CBC_SHA (0x0088)
                Cipher Suite: TLS_DHE_DSS_WITH_CAMELLIA_256_CBC_SHA (0x0087)
                Cipher Suite: TLS_ECDH_anon_WITH_AES_256_CBC_SHA (0xc019)
                Cipher Suite: TLS_DH_anon_WITH_AES_256_CBC_SHA (0x003a)
                Cipher Suite: TLS_DH_anon_WITH_CAMELLIA_256_CBC_SHA (0x0089)
                Cipher Suite: TLS_ECDHE_ECDSA_WITH_AES_128_CBC_SHA (0xc009)
                Cipher Suite: TLS_ECDHE_RSA_WITH_AES_128_CBC_SHA (0xc013)
                Cipher Suite: TLS_DHE_RSA_WITH_AES_128_CBC_SHA (0x0033)
                Cipher Suite: TLS_DHE_DSS_WITH_AES_128_CBC_SHA (0x0032)
                Cipher Suite: TLS_DHE_RSA_WITH_SEED_CBC_SHA (0x009a)
                Cipher Suite: TLS_DHE_DSS_WITH_SEED_CBC_SHA (0x0099)
                Cipher Suite: TLS_DHE_RSA_WITH_CAMELLIA_128_CBC_SHA (0x0045)
                Cipher Suite: TLS_DHE_DSS_WITH_CAMELLIA_128_CBC_SHA (0x0044)
                Cipher Suite: TLS_ECDH_anon_WITH_AES_128_CBC_SHA (0xc018)
                Cipher Suite: TLS_DH_anon_WITH_AES_128_CBC_SHA (0x0034)
                Cipher Suite: TLS_DH_anon_WITH_SEED_CBC_SHA (0x009b)
                Cipher Suite: TLS_DH_anon_WITH_CAMELLIA_128_CBC_SHA (0x0046)
                Cipher Suite: TLS_RSA_WITH_AES_256_GCM_SHA384 (0x009d)
                Cipher Suite: TLS_RSA_WITH_AES_256_CCM_8 (0xc0a1)
                Cipher Suite: TLS_RSA_WITH_AES_256_CCM (0xc09d)
                Cipher Suite: TLS_RSA_WITH_ARIA_256_GCM_SHA384 (0xc051)
                Cipher Suite: TLS_RSA_WITH_AES_128_GCM_SHA256 (0x009c)
                Cipher Suite: TLS_RSA_WITH_AES_128_CCM_8 (0xc0a0)
                Cipher Suite: TLS_RSA_WITH_AES_128_CCM (0xc09c)
                Cipher Suite: TLS_RSA_WITH_ARIA_128_GCM_SHA256 (0xc050)
                Cipher Suite: TLS_RSA_WITH_AES_256_CBC_SHA256 (0x003d)
                Cipher Suite: TLS_RSA_WITH_CAMELLIA_256_CBC_SHA256 (0x00c0)
                Cipher Suite: TLS_RSA_WITH_AES_128_CBC_SHA256 (0x003c)
                Cipher Suite: TLS_RSA_WITH_CAMELLIA_128_CBC_SHA256 (0x00ba)
                Cipher Suite: TLS_RSA_WITH_AES_256_CBC_SHA (0x0035)
                Cipher Suite: TLS_RSA_WITH_CAMELLIA_256_CBC_SHA (0x0084)
                Cipher Suite: TLS_RSA_WITH_AES_128_CBC_SHA (0x002f)
                Cipher Suite: TLS_RSA_WITH_SEED_CBC_SHA (0x0096)
                Cipher Suite: TLS_RSA_WITH_CAMELLIA_128_CBC_SHA (0x0041)
                Cipher Suite: TLS_EMPTY_RENEGOTIATION_INFO_SCSV (0x00ff)
            Compression Methods Length: 1
            Compression Methods (1 method)
                Compression Method: null (0)
            Extensions Length: 253
            Extension: server_name (len=21)
                Type: server_name (0)
                Length: 21
                Server Name Indication extension
                    Server Name list length: 19
                    Server Name Type: host_name (0)
                    Server Name length: 16
                    Server Name: en.wikipedia.org
            Extension: ec_point_formats (len=4)
                Type: ec_point_formats (11)
                Length: 4
                EC point formats Length: 3
                Elliptic curves point formats (3)
                    EC point format: uncompressed (0)
                    EC point format: ansiX962_compressed_prime (1)
                    EC point format: ansiX962_compressed_char2 (2)
            Extension: supported_groups (len=22)
                Type: supported_groups (10)
                Length: 22
                Supported Groups List Length: 20
                Supported Groups (10 groups)
                    Supported Group: x25519 (0x001d)
                    Supported Group: secp256r1 (0x0017)
                    Supported Group: x448 (0x001e)
                    Supported Group: secp521r1 (0x0019)
                    Supported Group: secp384r1 (0x0018)
                    Supported Group: ffdhe2048 (0x0100)
                    Supported Group: ffdhe3072 (0x0101)
                    Supported Group: ffdhe4096 (0x0102)
                    Supported Group: ffdhe6144 (0x0103)
                    Supported Group: ffdhe8192 (0x0104)
            Extension: next_protocol_negotiation (len=0)
                Type: next_protocol_negotiation (13172)
                Length: 0
            Extension: application_layer_protocol_negotiation (len=14)
                Type: application_layer_protocol_negotiation (16)
                Length: 14
                ALPN Extension Length: 12
                ALPN Protocol
                    ALPN string length: 2
                    ALPN Next Protocol: h2
                    ALPN string length: 8
                    ALPN Next Protocol: http/1.1
            Extension: encrypt_then_mac (len=0)
                Type: encrypt_then_mac (22)
                Length: 0
            Extension: extended_master_secret (len=0)
                Type: extended_master_secret (23)
                Length: 0
            Extension: post_handshake_auth (len=0)
                Type: post_handshake_auth (49)
                Length: 0
            Extension: signature_algorithms (len=48)
                Type: signature_algorithms (13)
                Length: 48
                Signature Hash Algorithms Length: 46
                Signature Hash Algorithms (23 algorithms)
                    Signature Algorithm: ecdsa_secp256r1_sha256 (0x0403)
                        Signature Hash Algorithm Hash: SHA256 (4)
                        Signature Hash Algorithm Signature: ECDSA (3)
                    Signature Algorithm: ecdsa_secp384r1_sha384 (0x0503)
                        Signature Hash Algorithm Hash: SHA384 (5)
                        Signature Hash Algorithm Signature: ECDSA (3)
                    Signature Algorithm: ecdsa_secp521r1_sha512 (0x0603)
                        Signature Hash Algorithm Hash: SHA512 (6)
                        Signature Hash Algorithm Signature: ECDSA (3)
                    Signature Algorithm: ed25519 (0x0807)
                        Signature Hash Algorithm Hash: Unknown (8)
                        Signature Hash Algorithm Signature: Unknown (7)
                    Signature Algorithm: ed448 (0x0808)
                        Signature Hash Algorithm Hash: Unknown (8)
                        Signature Hash Algorithm Signature: Unknown (8)
                    Signature Algorithm: rsa_pss_pss_sha256 (0x0809)
                        Signature Hash Algorithm Hash: Unknown (8)
                        Signature Hash Algorithm Signature: Unknown (9)
                    Signature Algorithm: rsa_pss_pss_sha384 (0x080a)
                        Signature Hash Algorithm Hash: Unknown (8)
                        Signature Hash Algorithm Signature: Unknown (10)
                    Signature Algorithm: rsa_pss_pss_sha512 (0x080b)
                        Signature Hash Algorithm Hash: Unknown (8)
                        Signature Hash Algorithm Signature: Unknown (11)
                    Signature Algorithm: rsa_pss_rsae_sha256 (0x0804)
                        Signature Hash Algorithm Hash: Unknown (8)
                        Signature Hash Algorithm Signature: SM2 (4)
                    Signature Algorithm: rsa_pss_rsae_sha384 (0x0805)
                        Signature Hash Algorithm Hash: Unknown (8)
                        Signature Hash Algorithm Signature: Unknown (5)
                    Signature Algorithm: rsa_pss_rsae_sha512 (0x0806)
                        Signature Hash Algorithm Hash: Unknown (8)
                        Signature Hash Algorithm Signature: Unknown (6)
                    Signature Algorithm: rsa_pkcs1_sha256 (0x0401)
                        Signature Hash Algorithm Hash: SHA256 (4)
                        Signature Hash Algorithm Signature: RSA (1)
                    Signature Algorithm: rsa_pkcs1_sha384 (0x0501)
                        Signature Hash Algorithm Hash: SHA384 (5)
                        Signature Hash Algorithm Signature: RSA (1)
                    Signature Algorithm: rsa_pkcs1_sha512 (0x0601)
                        Signature Hash Algorithm Hash: SHA512 (6)
                        Signature Hash Algorithm Signature: RSA (1)
                    Signature Algorithm: SHA224 ECDSA (0x0303)
                        Signature Hash Algorithm Hash: SHA224 (3)
                        Signature Hash Algorithm Signature: ECDSA (3)
                    Signature Algorithm: ecdsa_sha1 (0x0203)
                        Signature Hash Algorithm Hash: SHA1 (2)
                        Signature Hash Algorithm Signature: ECDSA (3)
                    Signature Algorithm: SHA224 RSA (0x0301)
                        Signature Hash Algorithm Hash: SHA224 (3)
                        Signature Hash Algorithm Signature: RSA (1)
                    Signature Algorithm: rsa_pkcs1_sha1 (0x0201)
                        Signature Hash Algorithm Hash: SHA1 (2)
                        Signature Hash Algorithm Signature: RSA (1)
                    Signature Algorithm: SHA224 DSA (0x0302)
                        Signature Hash Algorithm Hash: SHA224 (3)
                        Signature Hash Algorithm Signature: DSA (2)
                    Signature Algorithm: SHA1 DSA (0x0202)
                        Signature Hash Algorithm Hash: SHA1 (2)
                        Signature Hash Algorithm Signature: DSA (2)
                    Signature Algorithm: SHA256 DSA (0x0402)
                        Signature Hash Algorithm Hash: SHA256 (4)
                        Signature Hash Algorithm Signature: DSA (2)
                    Signature Algorithm: SHA384 DSA (0x0502)
                        Signature Hash Algorithm Hash: SHA384 (5)
                        Signature Hash Algorithm Signature: DSA (2)
                    Signature Algorithm: SHA512 DSA (0x0602)
                        Signature Hash Algorithm Hash: SHA512 (6)
                        Signature Hash Algorithm Signature: DSA (2)
            Extension: supported_versions (len=9)
                Type: supported_versions (43)
                Length: 9
                Supported Versions length: 8
                Supported Version: TLS 1.3 (0x0304)
                Supported Version: TLS 1.2 (0x0303)
                Supported Version: TLS 1.1 (0x0302)
                Supported Version: TLS 1.0 (0x0301)
            Extension: psk_key_exchange_modes (len=2)
                Type: psk_key_exchange_modes (45)
                Length: 2
                PSK Key Exchange Modes Length: 1
                PSK Key Exchange Mode: PSK with (EC)DHE key establishment (psk_dhe_ke) (1)
            Extension: key_share (len=38)
                Type: key_share (51)
                Length: 38
                Key Share extension
                    Client Key Share Length: 36
                    Key Share Entry: Group: x25519, Key Exchange length: 32
                        Group: x25519 (29)
                        Key Exchange Length: 32
                        Key Exchange: f5ab1935c8d46b21fffe1ef5e99bc220b680553ced1d7ab5b43e5c1c9ca4e861
            Extension: padding (len=43)
                Type: padding (21)
                Length: 43
                Padding Data: 000000000000000000000000000000000000000000000000000000000000000000000000…
            [JA3 Fullstring [truncated]: 771,4866-4867-4865-49196-49200-163-159-52393-52392-52394-49327-49325-49315-49311-49245-49249-49239-49235-167-49195-49199-162-158-49326-49324-49314-49310-49244-49248-49238-49234-166-49188-49192-107-106-49267-492]
            [JA3: 110d16d6deea0918fb3fec92406ba693]

    5 0.069261154 208.80.153.224 → 172.16.155.129 TCP 60 443 → 34898 [ACK] Seq=1 Ack=518 Win=64240 Len=0
Frame 5: 60 bytes on wire (480 bits), 60 bytes captured (480 bits) on interface eth0, id 0
    Section number: 1
    Interface id: 0 (eth0)
        Interface name: eth0
    Encapsulation type: Ethernet (1)
    Arrival Time: Feb 27, 2023 18:46:40.782586321 UTC
    [Time shift for this packet: 0.000000000 seconds]
    Epoch Time: 1677523600.782586321 seconds
    [Time delta from previous captured frame: 0.000325319 seconds]
    [Time delta from previous displayed frame: 0.000325319 seconds]
    [Time since reference or first frame: 0.069261154 seconds]
    Frame Number: 5
    Frame Length: 60 bytes (480 bits)
    Capture Length: 60 bytes (480 bits)
    [Frame is marked: False]
    [Frame is ignored: False]
    [Protocols in frame: eth:ethertype:ip:tcp]
Ethernet II, Src: VMware_e4:5c:4a (00:50:56:e4:5c:4a), Dst: VMware_3d:df:29 (00:0c:29:3d:df:29)
    Destination: VMware_3d:df:29 (00:0c:29:3d:df:29)
        Address: VMware_3d:df:29 (00:0c:29:3d:df:29)
        .... ..0. .... .... .... .... = LG bit: Globally unique address (factory default)
        .... ...0 .... .... .... .... = IG bit: Individual address (unicast)
    Source: VMware_e4:5c:4a (00:50:56:e4:5c:4a)
        Address: VMware_e4:5c:4a (00:50:56:e4:5c:4a)
        .... ..0. .... .... .... .... = LG bit: Globally unique address (factory default)
        .... ...0 .... .... .... .... = IG bit: Individual address (unicast)
    Type: IPv4 (0x0800)
    Padding: 000000000000
Internet Protocol Version 4, Src: 208.80.153.224, Dst: 172.16.155.129
    0100 .... = Version: 4
    .... 0101 = Header Length: 20 bytes (5)
    Differentiated Services Field: 0x00 (DSCP: CS0, ECN: Not-ECT)
        0000 00.. = Differentiated Services Codepoint: Default (0)
        .... ..00 = Explicit Congestion Notification: Not ECN-Capable Transport (0)
    Total Length: 40
    Identification: 0x0a70 (2672)
    000. .... = Flags: 0x0
        0... .... = Reserved bit: Not set
        .0.. .... = Don't fragment: Not set
        ..0. .... = More fragments: Not set
    ...0 0000 0000 0000 = Fragment Offset: 0
    Time to Live: 128
    Protocol: TCP (6)
    Header Checksum: 0x7e9d [validation disabled]
    [Header checksum status: Unverified]
    Source Address: 208.80.153.224
    Destination Address: 172.16.155.129
Transmission Control Protocol, Src Port: 443, Dst Port: 34898, Seq: 1, Ack: 518, Len: 0
    Source Port: 443
    Destination Port: 34898
    [Stream index: 0]
    [Conversation completeness: Incomplete, DATA (15)]
    [TCP Segment Len: 0]
    Sequence Number: 1    (relative sequence number)
    Sequence Number (raw): 4010768874
    [Next Sequence Number: 1    (relative sequence number)]
    Acknowledgment Number: 518    (relative ack number)
    Acknowledgment number (raw): 414532624
    0101 .... = Header Length: 20 bytes (5)
    Flags: 0x010 (ACK)
        000. .... .... = Reserved: Not set
        ...0 .... .... = Accurate ECN: Not set
        .... 0... .... = Congestion Window Reduced: Not set
        .... .0.. .... = ECN-Echo: Not set
        .... ..0. .... = Urgent: Not set
        .... ...1 .... = Acknowledgment: Set
        .... .... 0... = Push: Not set
        .... .... .0.. = Reset: Not set
        .... .... ..0. = Syn: Not set
        .... .... ...0 = Fin: Not set
        [TCP Flags: ·······A····]
    Window: 64240
    [Calculated window size: 64240]
    [Window size scaling factor: -2 (no window scaling used)]
    Checksum: 0xb353 [unverified]
    [Checksum Status: Unverified]
    Urgent Pointer: 0
    [Timestamps]
        [Time since first frame in this TCP stream: 0.069261154 seconds]
        [Time since previous frame in this TCP stream: 0.000325319 seconds]
    [SEQ/ACK analysis]
        [This is an ACK to the segment in frame: 4]
        [The RTT to ACK the segment was: 0.000325319 seconds]
        [iRTT: 0.038571429 seconds]

    6 0.108911911 208.80.153.224 → 172.16.155.129 TLSv1.3 4979 Server Hello, Change Cipher Spec, Encrypted Extensions, Certificate, Certificate Verify, Finished
Frame 6: 4979 bytes on wire (39832 bits), 4979 bytes captured (39832 bits) on interface eth0, id 0
    Section number: 1
    Interface id: 0 (eth0)
        Interface name: eth0
    Encapsulation type: Ethernet (1)
    Arrival Time: Feb 27, 2023 18:46:40.822237078 UTC
    [Time shift for this packet: 0.000000000 seconds]
    Epoch Time: 1677523600.822237078 seconds
    [Time delta from previous captured frame: 0.039650757 seconds]
    [Time delta from previous displayed frame: 0.039650757 seconds]
    [Time since reference or first frame: 0.108911911 seconds]
    Frame Number: 6
    Frame Length: 4979 bytes (39832 bits)
    Capture Length: 4979 bytes (39832 bits)
    [Frame is marked: False]
    [Frame is ignored: False]
    [Protocols in frame [truncated]: eth:ethertype:ip:tcp:tls:x509sat:x509sat:x509sat:x509sat:pkcs-1:x509ce:x509ce:x509ce:x509ce:x509ce:pkix1implicit:x509ce:x509ce:pkix1explicit:tls:x509sat:x509sat:x509sat:x509sat:x509sat:x509sat:x509ce:x509ce]
Ethernet II, Src: VMware_e4:5c:4a (00:50:56:e4:5c:4a), Dst: VMware_3d:df:29 (00:0c:29:3d:df:29)
    Destination: VMware_3d:df:29 (00:0c:29:3d:df:29)
        Address: VMware_3d:df:29 (00:0c:29:3d:df:29)
        .... ..0. .... .... .... .... = LG bit: Globally unique address (factory default)
        .... ...0 .... .... .... .... = IG bit: Individual address (unicast)
    Source: VMware_e4:5c:4a (00:50:56:e4:5c:4a)
        Address: VMware_e4:5c:4a (00:50:56:e4:5c:4a)
        .... ..0. .... .... .... .... = LG bit: Globally unique address (factory default)
        .... ...0 .... .... .... .... = IG bit: Individual address (unicast)
    Type: IPv4 (0x0800)
Internet Protocol Version 4, Src: 208.80.153.224, Dst: 172.16.155.129
    0100 .... = Version: 4
    .... 0101 = Header Length: 20 bytes (5)
    Differentiated Services Field: 0x00 (DSCP: CS0, ECN: Not-ECT)
        0000 00.. = Differentiated Services Codepoint: Default (0)
        .... ..00 = Explicit Congestion Notification: Not ECN-Capable Transport (0)
    Total Length: 4965
    Identification: 0x0a71 (2673)
    000. .... = Flags: 0x0
        0... .... = Reserved bit: Not set
        .0.. .... = Don't fragment: Not set
        ..0. .... = More fragments: Not set
    ...0 0000 0000 0000 = Fragment Offset: 0
    Time to Live: 128
    Protocol: TCP (6)
    Header Checksum: 0x6b5f [validation disabled]
    [Header checksum status: Unverified]
